{
  "schemaVersion": "1.0",
  "provider": "longcat",
  "health": {
    "status": "healthy",
    "lastSuccessfulAt": "2026-10-31T07:01:54.411Z",
    "lastAttemptAt": "2026-10-31T07:01:54.411Z",
    "consecutiveFailures": 0
  },
  "source": {
    "url": "https://api.longcat.chat/openai/v1/models",
    "retrievedAt": "2026-09-26T12:52:35.759Z",
    "contentHash": "sha256:22f505ac55bf05fc1978818830525c07bc96c01f48414a584400fbc6edbb4b03"
  },
  "models": [
    {
      "id": "LongCat-2.0",
      "ownedBy": "LongCat",
      "displayName": "LongCat-2.0",
      "contextTokens": 1048576,
      "maxOutputTokens": 131072
    },
    {
      "id": "LongCat-2.5-Preview",
      "ownedBy": "LongCat",
      "displayName": "LongCat-2.5-Preview",
      "contextTokens": 1048576,
      "maxOutputTokens": 262144
    }
  ],
  "comparison": {
    "status": "match",
    "pricedAndListed": [
      "LongCat-2.0",
      "LongCat-2.5-Preview"
    ],
    "aliasesAndListed": [],
    "listedWithoutPricing": [],
    "pricedButNotListed": [],
    "activeAliasesNotListed": []
  }
}
