{
  "schemaVersion": "1.0",
  "provider": "deepseek",
  "health": {
    "status": "healthy",
    "lastSuccessfulAt": "2026-10-25T06:11:47.263Z",
    "lastAttemptAt": "2026-10-25T06:11:47.263Z",
    "consecutiveFailures": 0
  },
  "source": {
    "url": "https://api.deepseek.com/models",
    "retrievedAt": "2026-09-23T06:02:05.042Z",
    "contentHash": "sha256:2e398df118be0724870973982b3cc72b83b8dd1d99d538507d2a0eb01cb22ebc"
  },
  "models": [
    {
      "id": "deepseek-flash",
      "ownedBy": "deepseek",
      "contextTokens": 1048576,
      "maxOutputTokens": 393216
    },
    {
      "id": "deepseek-v4-pro",
      "ownedBy": "deepseek",
      "contextTokens": 1048576,
      "maxOutputTokens": 393216
    }
  ],
  "comparison": {
    "status": "match",
    "pricedAndListed": [
      "deepseek-flash",
      "deepseek-v4-pro"
    ],
    "aliasesAndListed": [],
    "listedWithoutPricing": [],
    "pricedButNotListed": [],
    "activeAliasesNotListed": []
  }
}
