{
  "schemaVersion": "1.0",
  "provider": "moonshot-cn",
  "health": {
    "status": "healthy",
    "lastSuccessfulAt": "2026-10-29T14:24:36.372Z",
    "lastAttemptAt": "2026-10-29T14:24:36.372Z",
    "consecutiveFailures": 0
  },
  "source": {
    "url": "https://api.moonshot.cn/v1/models",
    "retrievedAt": "2026-10-29T14:24:36.372Z",
    "contentHash": "sha256:6c46a07d9fde9ae5e5a2aee3acd5af8a955cdf5ccfb3627e09b4757dff82a690"
  },
  "models": [
    {
      "id": "kimi-k2.6",
      "ownedBy": "moonshot",
      "contextTokens": 262144
    },
    {
      "id": "kimi-k2.7-code",
      "ownedBy": "moonshot",
      "contextTokens": 262144
    },
    {
      "id": "kimi-k2.7-code-highspeed",
      "ownedBy": "moonshot",
      "contextTokens": 262144
    },
    {
      "id": "kimi-k3",
      "ownedBy": "moonshot",
      "contextTokens": 1048576
    },
    {
      "id": "kimi-k3.1-pro",
      "ownedBy": "moonshot",
      "contextTokens": 1048576
    }
  ],
  "comparison": {
    "status": "mismatch",
    "pricedAndListed": [
      "kimi-k2.6",
      "kimi-k2.7-code",
      "kimi-k2.7-code-highspeed",
      "kimi-k3"
    ],
    "aliasesAndListed": [],
    "listedWithoutPricing": [
      "kimi-k3.1-pro"
    ],
    "pricedButNotListed": [],
    "activeAliasesNotListed": []
  }
}
