{
  "schemaVersion": "1.0",
  "provider": "zhipu-cn",
  "health": {
    "status": "healthy",
    "lastSuccessfulAt": "2026-10-31T13:41:07.087Z",
    "lastAttemptAt": "2026-10-31T13:41:07.087Z",
    "consecutiveFailures": 0
  },
  "source": {
    "url": "https://open.bigmodel.cn/api/paas/v4/models",
    "retrievedAt": "2026-09-18T05:58:41.162Z",
    "contentHash": "sha256:67a7862f6b9d98e0ac8970d24d53248267ebffc9817f9bc153e1f4037ba19b23"
  },
  "models": [
    {
      "id": "glm-4.5",
      "ownedBy": "z-ai"
    },
    {
      "id": "glm-4.5-air",
      "ownedBy": "z-ai"
    },
    {
      "id": "glm-4.6",
      "ownedBy": "z-ai"
    },
    {
      "id": "glm-4.7",
      "ownedBy": "z-ai"
    },
    {
      "id": "glm-5",
      "ownedBy": "z-ai"
    },
    {
      "id": "glm-5-turbo",
      "ownedBy": "z-ai"
    },
    {
      "id": "glm-5.1",
      "ownedBy": "z-ai"
    },
    {
      "id": "glm-5.2",
      "ownedBy": "z-ai"
    },
    {
      "id": "glm-5.3",
      "ownedBy": "z-ai"
    },
    {
      "id": "glm-5.3-flash",
      "ownedBy": "z-ai"
    },
    {
      "id": "glm-5.3-flashx",
      "ownedBy": "z-ai"
    }
  ],
  "comparison": {
    "status": "mismatch",
    "pricedAndListed": [
      "glm-4.5-air",
      "glm-4.7",
      "glm-5",
      "glm-5-turbo",
      "glm-5.1",
      "glm-5.2",
      "glm-5.3",
      "glm-5.3-flash",
      "glm-5.3-flashx"
    ],
    "aliasesAndListed": [],
    "listedWithoutPricing": [
      "glm-4.5",
      "glm-4.6"
    ],
    "pricedButNotListed": [
      "glm-4-flash-250414",
      "glm-4-flashx-250414",
      "glm-4-long",
      "glm-4.7-flash",
      "glm-4.7-flashx",
      "glm-5.3-flashx-legal"
    ],
    "activeAliasesNotListed": []
  }
}
